{
  "artifact_type": "render-provenance",
  "artifact_version": "1",
  "artifact_id": "provenance:platform-html:composition:slides-de-nordlicht",
  "renderer": {
    "kind": "platform",
    "name": "cogni-publishing/design-render-platform-html",
    "version": "0.0.29",
    "target": "html"
  },
  "design_system": {
    "name": "boardroom",
    "version": "0.0.16"
  },
  "content_fingerprint": "sha256:0e08b75ccdd47b91c52309511b63e8a2a78d05f5da8d80cf86d8cd117e72b680",
  "outputs": {
    "artifact": {
      "path": "index.html",
      "sha256": "sha256:c37355bae22727d4284957a84f16f17fa4c282cbc59d2bf75d2de43caad8ed88"
    }
  },
  "reproducible": false
}
