{
  "artifact_type": "render-provenance",
  "artifact_version": "1",
  "artifact_id": "provenance:platform-pptx:composition:slides-de-nordlicht",
  "renderer": {
    "kind": "platform",
    "name": "presentations:Presentations",
    "version": "26.909.22227",
    "target": "pptx"
  },
  "design_system": {
    "name": "boardroom",
    "version": "0.0.16"
  },
  "content_fingerprint": "sha256:0e08b75ccdd47b91c52309511b63e8a2a78d05f5da8d80cf86d8cd117e72b680",
  "outputs": {
    "artifact": {
      "path": "deck.pptx",
      "sha256": "sha256:359307005a667756f8ecbdd1a89b6ee654795f2722cf7723547f55841b9a6eb4"
    }
  },
  "reproducible": false
}
